{
  "task_id": "task_20260306_073643_0d213553",
  "run_id": "run_073cbf6d",
  "session_key": "",
  "parent_session_key": "agent:main:telegram:direct:unknown",
  "status": "completed",
  "summary": "Phase C Readiness: SCORE 100/100, RECOMMENDATION: PROCEED (HIGH confidence). Leak rate: 0.00% (was 11.80%). All gates passing. Gate tests: 20/20. E2E tests: 1079/1088 (99.2%). Detection accuracy: 98% TPR. No patch-related regressions. 8 pre-existing test failures are floating-point precision issues unrelated to numeric leak fix.",
  "artifacts": [],
  "error": null,
  "notify_user": true,
  "written_at": "2026-03-06T07:41:11.515556",
  "retry_count": 0,
  "metadata": {}
}