{
  "task_id": "auto_20260306_220608_run_fa4f",
  "run_id": "run_fa4f79db",
  "session_key": "",
  "parent_session_key": "",
  "status": "completed",
  "summary": "Auto-detected subagent completion",
  "artifacts": [],
  "error": null,
  "notify_user": true,
  "written_at": "2026-03-06T22:06:08.482418",
  "retry_count": 0,
  "metadata": {}
}