{
  "task_id": "task_20260306_064952_c7e45a7f",
  "run_id": "run_e4871e07",
  "session_key": "",
  "parent_session_key": "agent:main:telegram:direct:unknown",
  "status": "completed",
  "summary": "MVP11.5 Task A完成: 分析了5782条真实流量shadow数据(排除208条测试数据)，violation_rate=24.40%，numeric_leak_rate=11.80%。抽样复核35个样本(25 violation + 10 non-violation)，确认FP=0%，FN=0%。结论: NOT_READY，主要blocker为numeric_leak_rate严重超标(11.80% vs 0%)和violation_rate超标(24.40% vs 5%)，且数据采集窗口仅38分钟，真实流量占比<1%。已生成MVP11_5_shadow_readiness.md、shadow_metrics_snapshot.json、shadow_samples_review.json三个交付物。",
  "artifacts": [],
  "error": null,
  "notify_user": true,
  "written_at": "2026-03-06T06:55:17.078902",
  "retry_count": 0,
  "metadata": {}
}