{
  "task_id": "task_20260306_173255_089c6632",
  "run_id": "run_d6fcb875",
  "session_key": "agent:main:subagent:1a15ea97-dbbc-41bf-8046-24880d817a4c",
  "parent_session_key": "agent:main:telegram:direct:unknown",
  "status": "completed",
  "summary": "当前 America/Winnipeg 时区日期时间：2026-03-06 17:33:23 CST (Friday)",
  "artifacts": [],
  "error": null,
  "notify_user": true,
  "written_at": "2026-03-06T17:33:27.088690",
  "retry_count": 0,
  "metadata": {}
}